<?xml version="1.0" encoding="UTF-8" standalone="no"?>
<!DOCTYPE librairie SYSTEM "Librairie.dtd">
<librairie>
    <entete>Ceci est l'entÃªte de la librairie</entete>
    <livre isbn="27877877979-5487">
        <titre>Le jardinage</titre>
        <auteurs>
            <auteur>
                <nom>Dujardin</nom>
                <prenom>Jean</prenom>
            </auteur>
            <auteur>
                <nom>Dupond</nom>
            </auteur>
            <auteur>
                <nom>Francis</nom>
                <prenom>Delamote</prenom>
            </auteur>
        </auteurs>
        <description>Le premier livre qui parle vraiment de jardinage</description>
        <prix devise="euro" type="TCC">10</prix>
    </livre>
    <livre isbn="27717877979-5487">
        <titre>Le grand tour du monde</titre>
        <auteurs>
            <collectif>
                <direction>
                    <auteur>
                        <nom>Olivier</nom>
                        <prenom>Laplace</prenom>
                    </auteur>
                </direction>
                <membres>
                    Patrice - Patricia
                </membres>
            </collectif>
        </auteurs>
        <description>Le tour du monde vu par Olivier</description>
        <prix devise="livre" type="HT">21</prix>
    </livre>
</librairie>